{
  "$schema": "https://json-schema.org/draft/2020-12/schema",
  "$id": "https://basis-core/schemas/audit-event.schema.json",
  "title": "AuditEvent",
  "description": "Normalized record of a security-relevant system event. All authorization decisions, policy changes, identity lifecycle events, and emergency overrides are expressed as AuditEvent records. Field names are stable external identifiers — they must not be renamed once in production use.",
  "type": "object",
  "required": ["event_id", "event_type", "action", "timestamp"],
  "additionalProperties": false,
  "properties": {
    "event_id": {
      "type": "string",
      "minLength": 1,
      "description": "Unique identifier for this audit record. UUID v4. Auto-generated if not supplied."
    },
    "event_type": {
      "type": "string",
      "enum": [
        "authorization_decision",
        "policy_change",
        "identity_event",
        "emergency_override",
        "adapter_event",
        "system_event"
      ],
      "description": "Category of the event. Used for filtering and routing in the audit pipeline."
    },
    "timestamp": {
      "type": "string",
      "format": "date-time",
      "description": "ISO 8601 UTC timestamp of when the event occurred (not the time it was written to storage). Must include timezone offset."
    },
    "schema_version": {
      "type": "string",
      "description": "AuditEvent schema revision in effect when this record was written. Consumers use this to determine which fields are available. Current value: '1.1'."
    },
    "request_id": {
      "type": ["string", "null"],
      "minLength": 1,
      "description": "DecisionRequest.request_id. Links this audit record to the corresponding request and response. Null for events not associated with a DecisionRequest."
    },
    "decision_id": {
      "type": ["string", "null"],
      "minLength": 1,
      "description": "Identifier for the decision itself. Defaults to request_id when not separately assigned. Allows systems that assign their own decision IDs to carry that identifier in the audit record."
    },
    "correlation_id": {
      "type": ["string", "null"],
      "description": "Optional caller-provided trace identifier for cross-system correlation (e.g., HTTP request ID, distributed trace ID, batch job ID). Passed through from the caller verbatim."
    },
    "subject_id": {
      "type": ["string", "null"],
      "minLength": 1,
      "description": "Stable identifier of the subject. Null for system events with no associated principal."
    },
    "subject_name": {
      "type": ["string", "null"],
      "description": "Human-readable subject label. Null for system events."
    },
    "subject_type": {
      "type": ["string", "null"],
      "enum": ["human", "device", "service", "gateway", "agent", null],
      "description": "SubjectType value. Null for system events."
    },
    "subject_roles": {
      "type": "array",
      "items": {
        "type": "string",
        "minLength": 1
      },
      "default": [],
      "description": "Roles held by the subject at the time of the event. Empty for system events or subjects without role assignments."
    },
    "action": {
      "type": "string",
      "minLength": 1,
      "description": "Action name. Stable external identifier — appears verbatim in stored records."
    },
    "resource_id": {
      "type": ["string", "null"],
      "pattern": "^[a-z][a-z0-9_-]*(:[a-z0-9][a-z0-9_:/-]*)$",
      "description": "Normalized resource identifier. Null if the event is not resource-specific."
    },
    "resource_type": {
      "type": ["string", "null"],
      "description": "ResourceType value (e.g., 'hvac', 'sensor', 'device'). Null if the event is not resource-specific."
    },
    "outcome": {
      "type": ["string", "null"],
      "enum": ["allowed", "denied", "error", null],
      "description": "Outcome for authorization_decision events. Null for non-decision event types."
    },
    "reason": {
      "type": ["string", "null"],
      "description": "Human-readable explanation of the outcome. Null for non-decision events."
    },
    "evaluated_by": {
      "type": ["string", "null"],
      "description": "Name of the rule or component that produced the final decision. Null for non-decision events."
    },
    "policy_version": {
      "type": ["string", "null"],
      "description": "Version of the policy set in effect at evaluation time."
    },
    "matched_rules": {
      "type": "array",
      "items": {
        "type": "string",
        "minLength": 1
      },
      "default": [],
      "description": "Names of policy rules that returned allow or deny (not not_applicable) during evaluation. Empty for non-decision events or when no rules matched."
    },
    "trace": {
      "type": ["object", "null"],
      "description": "Per-rule evaluation history explaining why this decision was produced. Null when trace data was not collected.",
      "additionalProperties": false,
      "properties": {
        "final_outcome": {
          "type": "string",
          "enum": ["allow", "deny", "not_applicable"],
          "description": "The aggregated outcome produced by the engine."
        },
        "short_circuited": {
          "type": "boolean",
          "description": "True if evaluation stopped early because a DENY was found. Remaining rules were not evaluated."
        },
        "evaluated_rules": {
          "type": "array",
          "description": "Per-rule outcomes in evaluation order, up to and including the rule that determined the final outcome.",
          "items": {
            "type": "object",
            "required": ["rule_name", "outcome", "reason"],
            "additionalProperties": false,
            "properties": {
              "rule_name": {
                "type": "string",
                "minLength": 1,
                "description": "Name of the rule (evaluated_by field from the rule's Decision)."
              },
              "outcome": {
                "type": "string",
                "enum": ["allow", "deny", "not_applicable"],
                "description": "Outcome this rule returned."
              },
              "reason": {
                "type": "string",
                "description": "Reason string from the rule's Decision."
              }
            }
          }
        }
      }
    },
    "detail": {
      "type": "object",
      "description": "Arbitrary key/value context specific to this event."
    }
  }
}
